wind project name,article title,paragraph_id,code,quoted_evidence,opposition_or_support
nome,"""Diana Haecker, 'Council informs Sen. Murkowski of Nome’s needs and wants', Nome Nugget, The (online), 21 Apr 2022 1 for nome..."":",Topping the list was...expand water and sewer services.,Economy,"Topping the list was funding for the Nome Deep-draft port expansion, but also the city’s ask for funds to further the combined housing project for teachers and Nome police officers, and NJUS projects to enhance the wind farm and expand water and sewer services.",support
nome,"""Diana Haecker, 'Council informs Sen. Murkowski of Nome’s needs and wants', Nome Nugget, The (online), 21 Apr 2022 1 for nome..."":","Part of the housing crisis...by a whopping 900,000 gallons",Sustainability and Climate Issues,"to potentially have 40 percent of electrical energy generated by wind, which would decrease reliance on diesel fuel by a whopping 900,000 gallons per year.",support
nome,"""Tyler Rhodes, NSEDC, Communications Director, 'Member communities have five more years to utilize their $1 million for nome..."":",Member communities have five...through NSEDC's Community Energy,Economy,NSEDC implemented the Community Energy Fund in 2009 and allocated $1 million to each NSEDC member community for energy-related projects.,support
nome,"""Tyler Rhodes, NSEDC, Communications Director, 'Member communities have five more years to utilize their $1 million for nome..."":",The program aims to reduce...funding for nine different projects.,Sustainability and Climate Issues,The program aims to reduce energy costs for Norton Sound residents by encouraging the construction of renewable energy systems,support
nome,"""Tyler Rhodes, NSEDC, Communications Director, 'Member communities have five more years to utilize their $1 million for nome..."":",NSEDC's Board of Directors...utilize the funding.,Infrastructure,NSEDC's Board of Directors recognizes that it takes time to plan and develop energy infrastructure improvement projects.,support
nome,"""Tyler Rhodes, NSEDC, Communications Director, 'Member communities have five more years to utilize their $1 million for nome..."":","""The Community Energy Fund...reduce costs for residents.""",Economy,"""The Community Energy Fund has already made several projects possible that have resulted in safer and more efficient energy systems for many of our communities,"" said NSEDC Board Chairman Dan Harrelson.",support
nome,"""Tyler Rhodes, NSEDC, Communications Director, 'Member communities have five more years to utilize their $1 million for nome..."":",Nome and Unalakleet are...power plant generators.,Sustainability and Climate Issues,"Nome and Unalakleet are the only two communities to have fully utilized their available funding, both putting their entire allocation toward large wind energy systems.",support
nome,"""Tyler Rhodes, NSEDC, Communications Director, 'Member communities have five more years to utilize their $1 million for nome..."":",NSEDC encourages municipalities and/or...Community Benefits Director Paul,Sustainability and Climate Issues,NSEDC encourages municipalities and/or utility providers in member communities to explore renewable or energy-efficiency projects that could receive financial support through NSEDC's Community Energy Fund.,support
nome," ""Staff, 'Briefs', Anchorage Daily News (online), 5 Feb 2001 B2 ‹https://infoweb.newsbank.com/apps/news/document-view? for nome...""",Nome Turbine project gets government's...Nome Joint Utility System's demand.,Sustainability and Climate Issues,The turbines would supply less  Joint Utility System's demand.,neutral
